Name,E-mail,Trade Name,Registration No.,Telephone,Address,Exchange Name,Validity
S. S. A. T. CONSULTANTS PRIVATE LIMITED,sanjeevgehani@ssatdirect.com,Sanjeevgehani,INZ000280832,9101143231000,"House No. 7411 DLF Phase - 4 Sikanderpur Ghosi 68 DLF Qe, Gurgaon",BOMBAY STOCK EXCHANGE LIMITED,"Mar 04, 2010 - Perpetual"
S.B. SECURITIES PRIVATE LIMITED,info@dhsecurities.com,Info,INZ000221834,9102226195070,"Hamam House, M2 Floor, Hamam Street, Fort,",INDIAN CLEARING CORPORATION LIMITED(ICCL),"Jan 13, 1998 - Perpetual"
S.P.JAIN SECURITIES PRIVATE LIMITED,spjainsec@yahoo.co.in,Spjainsec,INZ000218230,9102222666313,"2nd Floor, Rajabahadur Bldg. 14 Ambalal Doshi Marg, Fort,",INDIAN CLEARING CORPORATION LIMITED(ICCL),"Jul 07, 1999 - Perpetual"
SAAKETA INVESTMENT SERVICES LTD,naveenachandra@rediffmail.com,Naveenachandra,INZ000179131,0409127568107,3-4-616/1 2nd Floor Narayanaguda,NATIONAL STOCK EXCHANGE OF INDIA LIMITED,"Aug 08, 1995 - Perpetual"
SAAR SECURITIES (INDIA) PRIVATE LIMITED,saarsec@gmail.com,Saarsec,INZ000223939,9102228896266,"SHOP NO. 18, PLOT NO. 47, HAVELI FALIA, JALARAM MARKET, NAROLI TIN RASTA ,NAROLI, DADRA AND NAGAR HA",NATIONAL STOCK EXCHANGE OF INDIA LIMITED,"Jun 28, 2007 - Perpetual"
SACHDEVA STOCKS PRIVATE LIMITED,operations@sachdevastocks.com,Operations,INZ000292435,918829041067111,OPPOSITE SABZI MANDI UNA,INDIAN CLEARING CORPORATION LIMITED(ICCL),"Aug 30, 2007 - Perpetual"
SADRAVYA MONEY MANAGEMENT PRIVATE LIMITED,vibhu@sadravya.com,Vibhu,INZ000307633,001147454000,"12/45 A, GROUND FLOOR, PUNJABI BAGH,",NATIONAL STOCK EXCHANGE OF INDIA LIMITED,"Jun 10, 2022 - Perpetual"
SAFAL CAPITAL (INDIA) LIMITED,compliance@safalcapital.in,Compliance,INZ000155333,9107966633606,"238- CHITVAN SOCIETY, OPP - ABHIJYOT HARMONEY GALA GYMKHANA ROAD, BOPAL,",INDIAN CLEARING CORPORATION LIMITED(ICCL),"Aug 02, 2017 - Perpetual"
SAJAG SECURITIES PVT. LTD.,mahesh@sajag.com,Mahesh,INZ000221337,910205448670,"REGENT CHAMBERS,1ST FLOOROPP.GARWARE COLLEGE 33/15-B,KARVE ROAD,",NATIONAL STOCK EXCHANGE OF INDIA LIMITED,"Jul 26, 1995 - Perpetual"
SAL SECURITIES PVT. LTD.,admin@salsecurities.com,Admin,INZ000287438,9102261473232,"704, 7 TH FLOOR, HUBTOWN VIVA WESTERN EXPRESS HIGHWAY JOGESHWARI (EAST)",BOMBAY STOCK EXCHANGE LIMITED,"Sep 30, 2004 - Perpetual"
SALASAR STOCK BROKING LTD.,ssbl@vsnl.net,Ssbl,INZ000238734,9103322314400,"MUKTI CHAMBERS 4A,CLIVE ROW",NSE Clearing Limited,"Jul 26, 1995 - Perpetual"
SAMARTH MERCANTILE PVT LTD,service@samarthgroup.in,Service,INZ000013238,02241567100,"H20 APMC MARKET 1, PHASE 2 SECTOR 19",BOMBAY STOCK EXCHANGE LIMITED,"Dec 22, 2015 - Perpetual"
SAMCO SECURITIES LIMITED,info@samco.in,Info,INZ000002535,002224391813,"1004, A Wing, Naman Midtown, 10th Floor, Senapati Bapat Marg, Prabhadevi West, Mumbai",INDIAN CLEARING CORPORATION LIMITED(ICCL),"Feb 09, 2015 - Perpetual"
SAMRIDHI STOCKS PRIVATE LIMITED,jayantmaloo@samridhistocks.com,Jayantmaloo,INZ000191233,003330125000,"1ST FLOOR 2/2B, JUSTICE CHANDRA MAHADEV ROAD",BOMBAY STOCK EXCHANGE LIMITED,"Aug 24, 2006 - Perpetual"
SAMURAI SECURITIES PRIVATE LIMITED,admin@samuraisec.co.in,Admin,INZ000187234,9102266240800,"303/306, Raheja Chambers, Free Press Journal Marg, Nariman Point,",INDIAN CLEARING CORPORATION LIMITED(ICCL),"Aug 19, 2004 - Perpetual"
SAMYAG BROKING PRIVATE LIMITED,samyagbroking@gmail.com,Samyagbroking,INZ000181631,9102240971500,"C-9, Ground Floor, Satyam Shopping Centre M G Road, Ghatkopar-E",INDIAN CLEARING CORPORATION LIMITED(ICCL),"Aug 10, 2010 - Perpetual"
SANAT M DALAL SECURITIES PVT LTD,smdalal630@gmail.com,Smdalal630,INZ000234433,9102222836219,"Manek Mahal, 2nd Floor, 90,Veer Nariman Road, Next to Ambassador Hotel,",INDIAN CLEARING CORPORATION LIMITED(ICCL),"Jan 07, 1998 - Perpetual"
SANCHAY FINCOM LTD.,sanchayfin21@hotmail.com,Sanchayfin21,INZ000286735,910731432106,"209, RAJANI BHUVAN, 569,M.G.ROAD",INDIAN CLEARING CORPORATION LIMITED(ICCL),"Oct 20, 2000 - Perpetual"
SANCHAY FINVEST LTD.,mitu786@indiainfo.com,Mitu786,INZ000289036,91073125636091,"209,RAJANI BHUVAN,569,M.G.ROAD,",NATIONAL STOCK EXCHANGE OF INDIA LIMITED,"Jan 07, 2002 - Perpetual"
SANCHIT FINANCIAL & MANAGEMENT SERVICES LTD.,harsh_1st@yahoo.co.in,Harsh_1st,INZ000295835,9101832507131,"381-A,GREEN AVENUE",NATIONAL STOCK EXCHANGE OF INDIA LIMITED,"Oct 17, 1995 - Perpetual"
SANCTUM WEALTH PRIVATE LIMITED,neeraj.sirur@sanctumwealth.com,Neeraj.sirur,INZ000011338,9102262886100,"LEVEL 3, COWRKS , BIRLA CENTURION PANDURANG BUDHKAR MARG, CENTURY MILLS COMPOUND, WORLI,",NSE Clearing Limited,"Dec 02, 2015 - Perpetual"
SANGHAVI SAVLA STOCK BROKERS LTD.,hiten@sanbro.in,Hiten,INZ000182234,912225029000,"VESTA-B,1ST FLOOR 90 FEET ROAD,PANT NAGAR, GHATKOPAR (EAST)",METROPOLITAN STOCK EXCHANGE,"Aug 30, 1995 - Perpetual"
SANJAY AGARWAL BROKING LIMITED,sanjayagarwalbrokingltd@gmail.com,Sanjayagarwalbrokingltd,INZ000097519,9103346020776,"ECSL0710, 7TH FLOOR, AMBUJA NEOTIA ECOCENTRE EM 4, EM BLOCK, SECTOR V, NEAR TECHNO INDIA COLLEGE, SALT LAKE CITY",NSE Clearing Limited,"Jan 13, 2017 - Perpetual"
SANKALP FINANCE,info@sankalponline.com,Info,INZ000298721,9107940710000,"1705, Sankalp Square III,Nr Ornet Park-2, Opp Montecristo Banquet, Sindhu Bhavan road, Nr S P Road",NATIONAL STOCK EXCHANGE OF INDIA LIMITED,"Apr 16, 2021 - Perpetual"
SANKALP SHARE BROKERS PRIVATE LIMITED,info@sankalpcares.com,Info,INZ000285732,9103340127800,"ROOM NO. 313,14, NETAJI SUBHAS ROAD,3RD FLOOR,KOLKATA",INDIAN CLEARING CORPORATION LIMITED(ICCL),"Jan 23, 2006 - Perpetual"
SANTOOR LEAFIN PVT.LTD.,slpl1@rediffmail.com,Slpl1,INZ000296836,09102222840649,"10, Floor-grd, Plot-214, Raheja Centre, Free Press Journal Marg Nariman Point",NATIONAL STOCK EXCHANGE OF INDIA LIMITED,"Nov 22, 1995 - Perpetual"
SANTOSH KUMAR KEJRIWAL SECU.(P) LTD,vinay@kejriwalgroup.in,Vinay,INZ000182035,03339837700,"GOVIND BHAWAN,6TH FLOOR 2,BRABOURNE ROAD",NSE Clearing Limited,"Aug 08, 1995 - Perpetual"
SARA SECURITIES PRIVATE LIMITED,sarasecp@yahoo.co.in,Sarasecp,INZ000216732,9103322433369,"4TH FLOOR 56, NETAJI SUBHASH ROAD",INDIAN CLEARING CORPORATION LIMITED(ICCL),"Jul 22, 2004 - Perpetual"
SAROJ SECURITIES,contact@sarojsecurities.com,Contact,INZ000224427,9105122338334,"309,KAN CHAMBERS 14/113,CIVIL LINES",NATIONAL STOCK EXCHANGE OF INDIA LIMITED,"Aug 21, 2009 - Perpetual"
SATCO CAPITAL MARKETS LIMITED,connect@satco.co.in,Connect,INZ000198838,02266360432,"17, GROUND FLOOR, NOBLE CHAMBERS GHOGA STREET, JANMABHOOMI MARG,FORT,MUMBAI",NSE Clearing Limited,"Sep 09, 2014 - Perpetual"
SAURASHTRA CAPITAL SERVICES PVT. LTD.,info@saurashtracapital.in,Info,INZ000246238,9102240564056,"39, Great Western Bldg, 1st Floor Bake House Lane, Fort",INDIAN CLEARING CORPORATION LIMITED(ICCL),"Jul 07, 1995 - Perpetual"
SAURIN INVESTMENTS PRIVATE LIMITED,siplindia@hotmail.com,Siplindia,INZ000285637,9107926624000,"SIPL HOUSE, 14, BHAGWAN NAGAR TEKRO NR. MAHALAXMI CROSS ROAD, PALDI,",INDIAN CLEARING CORPORATION LIMITED(ICCL),"Nov 22, 1995 - Perpetual"
SAVA SECURITIES PRIVATE LIMITED,savasec@sanwaindia.com,Savasec,INZ000273432,910222334811,"SANWA HOUSE,97/99,BOMBAY SAMACHAR MARG FORT",NSE Clearing Limited,"Aug 08, 1995 - Perpetual"
SBI-SG GLOBAL SECURITIES SERVICES PRIVATE LIMITED,jignesh.modi@sbisgcsl.co.in,Jignesh.modi,INZ000164039,02202242066166,"B WING, JEEVAN SEVA, ANNEXE BLDG, GROUND FLOOR, S.V.ROAD, SANTCRAUZ (W),",INDIAN CLEARING CORPORATION LIMITED(ICCL),"Apr 01, 2010 - Perpetual"
SBICAP SECURITIES LIMITED,compliancecorporate@sbicapsec.com,Compliancecorporate,INZ000200032,9102242273300,"Marathon Futurex, Unit No. 1202, 12th Floor, B wing , Mafatlal Mill Compound, N M Joshi Marg Lower Parel,",NATIONAL STOCK EXCHANGE OF INDIA LIMITED,"Mar 08, 1999 - Perpetual"
SEH INVESTMENTS PVT. LIMITED,ashokjha@shahiindia.com,Ashokjha,INZ000291732,9101126819229,"F-88, OKHLA INDUSTRIAL AREA,PHASE 1",NATIONAL STOCK EXCHANGE OF INDIA LIMITED,"Feb 27, 1996 - Perpetual"
SERNET FINANCIAL SERVICES PRIVATE LIMITED,contact@sernetindia.com,Contact,INZ000189331,02228887964,"B/201,HEMU CLASSIC PREMISES CHS LTD., S.V. ROAD OPP. NEW ERA CINEMA, MALAD (WEST)",INDIAN CLEARING CORPORATION LIMITED(ICCL),"Nov 23, 2010 - Perpetual"
SETHI FINMART PRIVATE LIMITED,vivek.icon@gmail.com,Vivek.icon,INZ000240734,9103322820566,"12E,HARRINGTON MANSION,GROUND FLOOR 8,HO-CHI-MINH SARANI",NATIONAL STOCK EXCHANGE OF INDIA LIMITED,"Dec 28, 2006 - Perpetual"
SEVEN SALTS FINANCIAL SERVICES PRIVATE LIMITED,anupam@salt.one,Anupam,INZ000303532,9109899101094,"40, Renaissance HVV Valley, Jalahalli,",BOMBAY STOCK EXCHANGE LIMITED,"Jan 28, 2022 - Perpetual"
SHADOWFAX TRADERS,ramesh@shadowfaxtraders.com,Ramesh,INZ000010314,0919891006663,"40, JANAADHAR, MANGALA MARKET, BLOCK 45, ROAD 5, GIFT CITY",NATIONAL STOCK EXCHANGE OF INDIA LIMITED,"Oct 01, 2015 - Perpetual"
SHAH INVESTOR'S HOME LIMITED,compliance@sihi.in,Compliance,INZ000167335,9107941072309,"P04-01E, TOWER A, WORLD TRADE CENTRE BLOCK -51, ROAD 5E, ZONE-5, GYAN MARG, GIFT CITY",INDIAN CLEARING CORPORATION LIMITED(ICCL),"Aug 08, 1995 - Perpetual"
SHAILESH MERCHANT STOCK BROKERS PVT. LTD.,smmerchant@ymail.com,Smmerchant,INZ000267835,9102243471660,"64/A, Maker Chambers III, Nariman Point,",INDIAN CLEARING CORPORATION LIMITED(ICCL),"Feb 27, 1996 - Perpetual"
SHAILESH MULCHAND NISSAR,s_nissar@yahoo.co.in,S_nissar,INZ000248617,9102222722273,"611,P.J.TOWER, DALAL STREET FORT",BOMBAY STOCK EXCHANGE LIMITED,"Nov 26, 1992 - Perpetual"
SHAILESH SHAH SECURITIES PVT. LTD.,systems@dolatcapital.com,Systems,INZ000254439,9107965704168,"UNIT NO. P06 - 2A -PO6 -2D, TOWEA, WTC , BLOCK -51 ZONE -5, ROAD 5E, GIFT CITY",INDIAN CLEARING CORPORATION LIMITED(ICCL),"Sep 21, 1999 - Perpetual"
SHARAD AGARWAL BROKING SERVS P. LTD,sabsmum@gmail.com,Sabsmum,INZ000265636,9102226300588,"C 202 REMI BIZCOURT, SHAH INDUSTRIAL ESTATE, OFF VEERA DESAI ROAD, ANDHERI WEST",NATIONAL STOCK EXCHANGE OF INDIA LIMITED,"May 20, 1996 - Perpetual"
SHARE INDIA ALGOPLUS PRIVATE LIMITED,vikas_cs@shareindia.com,Vikas_cs,INZ000301934,9102242668080,"Cabin A, Unit 604 B, 6th Floor, Tower A, World Trade Centre, Gift City, Block-51, Zone-5, Road 5E, Gift City,",INDIAN CLEARING CORPORATION LIMITED(ICCL),"Sep 28, 2021 - Perpetual"
SHARE INDIA SECURITIES LIMITED,info@shareindia.com,Info,INZ000178336,9101143011000,"UNIT NO 604 A-B, 605 A-B, 6TH FLOOR, TOWER A, WORLD TRADE CENTRE, GIFT CITY, BLOCK 51, ZONE 5, ROAD 5E, GIFT CITY,",NATIONAL STOCK EXCHANGE OF INDIA LIMITED,"Mar 06, 2000 - Perpetual"
SHARE WISE EQUITY BROKERS PVT.LTD.,info.sharewise@gmail.com,Info.sharewise,INZ000300631,911142283201,"F-14/16, First Floor, Model Town, Part-2, North West Delhi,",BOMBAY STOCK EXCHANGE LIMITED,"Jul 30, 2021 - Perpetual"
SHAREKHAN LIMITED,compliance@sharekhan.com,Compliance,INZ000171337,9102267502000,"THE RUBY, 18TH FLOOR, 29 SENAPATI BAPTA MARG, DADAR WEST",INDIAN CLEARING CORPORATION LIMITED(ICCL),"Mar 26, 2018 - Perpetual"
SHAREWEALTH SECURITIES LTD.,peethambaran@sharewealthindia.com,Peethambaran,INZ000176636,04872436500,20 232 Aditya Lane M G Road West Fort Poothole PO Thrissur,INDIAN CLEARING CORPORATION LIMITED(ICCL),"Jan 23, 2006 - Perpetual"
SHAVETA STOCK & SECURITIES PRIVATE LIMITED,shavetastock@gmail.com,Shavetastock,INZ000182134,9101636503004,"1324/11,BADSHAHI BAG",INDIAN CLEARING CORPORATION LIMITED(ICCL),"Dec 28, 2006 - Perpetual"
SHILPA STOCK BROKER PRIVATE LIMITED,rakesh@ssbpl.net,Rakesh,INZ000201636,9102240324361,"B-11, 3RD FLOOR , PLOT NO-36, TAMARIND HOUSE, MUDHANA SHETTY MARG, HUTATMA CHOWK, FORT,",INDIAN CLEARING CORPORATION LIMITED(ICCL),"Jun 03, 1999 - Perpetual"
SHIVMANGAL SECURITIES PVT. LTD.,shivmangalsecurities@rediffmail.com,Shivmangalsecurities,INZ000216335,9103324005228,"35/8,TOLLYGUNGE CIRCULAR ROAD NEW ALIPORE",INDIAN CLEARING CORPORATION LIMITED(ICCL),"Oct 19, 1995 - Perpetual"
SHIVNARAYAN NEMANI SHARE & STOCK BROKERS PVT. LTD.,shivnema@yahoo.com,Shivnema,INZ000262532,9102222659567,"43, BHUPEN CHAMBERS, 2nd Floor, Dalal Street, Fort,",INDIAN CLEARING CORPORATION LIMITED(ICCL),"Dec 23, 1998 - Perpetual"
SHREE BALAJI MULTICOMMODITIES PVT LTD,narenderchangia@yahoo.com,Narenderchangia,INZ000077535,01542480443,33 G BLOCK,BOMBAY STOCK EXCHANGE LIMITED,"Dec 22, 2015 - Perpetual"
SHREE KANHA STOCK BROKING PRIVATE LIMITED,sksbpl@gmail.com,Sksbpl,INZ000222633,9107926460775,"406, Shail Building, Opp.Navrangpura Tel. Exchange Nr Madhusudan House, Navrangpura",INDIAN CLEARING CORPORATION LIMITED(ICCL),"Dec 17, 2004 - Perpetual"
SHREE NAMAN SECURITIES & FINANCE PRIVATE LIMITED,naman_mum@yahoo.com,Naman_mum,INZ000283937,9102228628953,"104, SHREE NAMAN PLAZA, 1ST FLOOR, OPP. SHANKAR LANE,S. V. ROAD, KANDIVALI",BOMBAY STOCK EXCHANGE LIMITED,"Oct 19, 1995 - Perpetual"
SHREE RAM FINCARE,srfmembership@gmail.com,Srfmembership,INZ000313927,01414188353,"603, SUN N MOON CHAMBERS, GOPALBARI, AJMER PULIA,",BOMBAY STOCK EXCHANGE LIMITED,"Jul 20, 2023 - Perpetual"
SHREE TISAI SECURITIES PRIVATE LIMITED,vishal@shreetisai.com,Vishal,INZ000215732,9102512312834,"A-109, Everest Tower, Santoshi Mata Road, Opp. Maxi Ground, Kalyan (W)",INDIAN CLEARING CORPORATION LIMITED(ICCL),"Oct 04, 2010 - Perpetual"
SHREEHARI SHARES & STOCK BROKERS LLP,shreehari09802@gmail.com,Shreehari09802,INZ000166031,9102222811934,"B/66, 6TH FLOOR, MITTAL TOWERS, NARIMAN POINT",NATIONAL STOCK EXCHANGE OF INDIA LIMITED,"Apr 16, 2004 - Perpetual"
SHREEKANT PHUMBHRA,shreekant.phumbhra@gmail.com,Shreekant.phumbhra,INZ000241419,910332211327,"16, INDIA EXCHANGE PLACE FIRST FLOOR, ROOM NO 21",NATIONAL STOCK EXCHANGE OF INDIA LIMITED,"Jan 20, 1994 - Perpetual"
SHRENI SHARES LTD,shrenisharespvtltd@yahoo.in,Shrenisharespvtltd,INZ000268538,9102242765276,"Office No.102, 1st Floor, Sea Lord CHS, 1/A, 1/B, Ram Nagar, Above Axis Bank, Borivali (West),",BOMBAY STOCK EXCHANGE LIMITED,"Sep 27, 2010 - Perpetual"
SHRI BRIJ SECURITIES PVT. LTD,info@shribrijsecurities.com,Info,INZ000183033,0222850199,"103,RAJENDRA CHAMBERS 19,NANABHAI LANE FOUNTAIN",BOMBAY STOCK EXCHANGE LIMITED,"Dec 12, 1997 - Perpetual"
SHRI KRISHNA SHARE BROKERS PRIVATE LIMITED,nk@taxonline.net.in,Nk,INZ000302434,9101143104754,"C-15/201 Acharya Niketan, Mayur Vihar Phase-I New Delhi East",BOMBAY STOCK EXCHANGE LIMITED,"Oct 07, 2021 - Perpetual"
SHRI PARASRAM HOLDINGS PVT. LTD.,anand@sphpl.com,Anand,INZ000220838,9101127420944,"GUPTA CHAMBERS,2ND FLOOR B-7,NIMRI SHOPPING CENTRE,BHARAT NAGAR,ASHOK VIHAR PHASE IV",INDIAN CLEARING CORPORATION LIMITED(ICCL),"Oct 19, 1995 - Perpetual"
SHRI RAM COMMODITIES,srchisar@gmail.com,Srchisar,INZ000029627,01662275551,124 125 A NEW GRAIN MARKET,BOMBAY STOCK EXCHANGE LIMITED,"Dec 22, 2015 - Perpetual"
SHRI VENKATESH STOCK BROKER SERVICES INDIA PRIVATE LIMITED,shri_vsb@yahoo.in,Shri_vsb,INZ000231135,9107714059071,"C-21/22, SHYAM MARKET JIWAN BIMA MARG,PANDRI",INDIAN CLEARING CORPORATION LIMITED(ICCL),"Jun 17, 2011 - Perpetual"
SHRIAM FINANCIAL PRIVATE LIMITED,nareshchugh2002@yahoo.co.in,Nareshchugh2002,INZ000278336,911512202332,Chugh Mansion Opp. DRM Office,METROPOLITAN STOCK EXCHANGE,"Aug 08, 2005 - Perpetual"
SHRIKANT G MANTRI,sgmantri738@gmail.com,Sgmantri738,INZ000267617,9102222672526,"Surya Mahal, 2nd Floor, Nagindas Master Road, Fort,",INDIAN CLEARING CORPORATION LIMITED(ICCL),"Nov 26, 1992 - Perpetual"
SHRIRAM INSIGHT SHARE BROKERS LIMITED,helpdesk@shriraminsight.com,Helpdesk,INZ000216238,004423587188,"MOOKAMBIKA COMPLEX 4 LADY DESIKA ROAD, MYLAPORE",BOMBAY STOCK EXCHANGE LIMITED,"Oct 22, 2003 - Perpetual"
SHRIYAM BROKING INTERMEDIARY LTD,raju@shriyam.com,Raju,INZ000274033,9102240090518,"712-713,TULSIANI CHAMBERS, 212, NARIMAN POINT,",NATIONAL STOCK EXCHANGE OF INDIA LIMITED,"Nov 15, 1994 - Perpetual"
SHUBHAM STOCK BROKING SERVICES PVT. LTD.,shubham_asr@yahoo.com,Shubham_asr,INZ000287736,9102228347355,"102/5,ANMOL HOUSING SOCIETY,M.V.ROAD,MAROL,ANDHERI (EAST)",NATIONAL STOCK EXCHANGE OF INDIA LIMITED,"Mar 16, 2006 - Perpetual"
SI INVESTMENTS & BROKING PRIVATE LIMITED,anandpv9@gmail.com,Anandpv9,INZ000272531,9102222722180,"402, ROTUNDA BUILDING, B.S. MARG, FORT",NSE Clearing Limited,"Jan 13, 1998 - Perpetual"
SIC STOCKS & SERVICES PRIVATE LIMITED,bripal@sicststock.com,Bripal,INZ000289933,9108025329222,"501,Prestige Meridian II, 29,30, M.G. Road,",INDIAN CLEARING CORPORATION LIMITED(ICCL),"Apr 16, 2004 - Perpetual"
SIDDHARTHA COMMODITIES PVT LTD,jaipurscpl@gmail.com,Jaipurscpl,INZ000086139,01412610555,"C73 ADARSH NAGAR,NEAR ADARSH NAGAR POLICE STATION",NATIONAL STOCK EXCHANGE OF INDIA LIMITED,"Dec 05, 2015 - Perpetual"
SILVER STREAM EQUITIES PRIVATE LIMITED,vivek.sheth@silverstream.co.in,Vivek.sheth,INZ000198335,9102240421073,11 G CINEMA SCREEN 3 BUILDING SOMNATH JUNCTION VILLAGE DABHEL DAMAN,INDIAN CLEARING CORPORATION LIMITED(ICCL),"Dec 21, 2009 - Perpetual"
SINGHAL CAPITAL SERVICES LTD,singhalcapital@vsnl.com,Singhalcapital,INZ000286134,910113278800,"G-5 4353,MADAN MOHAN STREET,4C,ANSARI ROAD,DARYA GANJ,",NATIONAL STOCK EXCHANGE OF INDIA LIMITED,"Jul 26, 1995 - Perpetual"
SIXTH SENSE SECURITIES PRIVATE LIMITED,mittalankit2003@yahoo.com,Mittalankit2003,INZ000307736,09101149124667,"108, 1st Floor, D Mall Netaji Subhash Place, Pitampura",BOMBAY STOCK EXCHANGE LIMITED,"Jun 30, 2022 - Perpetual"
SKI CAPITAL SERVICES LTD.,contact@skicapital.net,Contact,INZ000188835,001145046000,"718,JOSHI ROAD KAROL BAGH",INDIAN CLEARING CORPORATION LIMITED(ICCL),"Oct 19, 1995 - Perpetual"
SKP SECURITIES LIMITED,shilpisureka@skpmoneywise.com,Shilpisureka,INZ000199335,003340077000,"33-A, JAWAHARLAL NEHRU ROAD 21ST FLOOR,CHATTERJEE INTERNATIONAL CENTER",INDIAN CLEARING CORPORATION LIMITED(ICCL),"Apr 02, 1996 - Perpetual"
SKS CAPITAL & RESEARCH PRIVATE LIMITED,s_ghosh@sksspl.com,S_ghosh,INZ000223739,9103322831835,"N-218,IDEAL PLAZA, 11/1,SARAT BOSE ROAD",NATIONAL STOCK EXCHANGE OF INDIA LIMITED,"Jul 27, 2000 - Perpetual"
SKSE SECURITIES LIMITED,ceo@sksesl.com,Ceo,INZ000221032,9102812455123,"Saket Plaza, 2nd Floor,Dr Rajendra Prasad Road, Panchnath Plot Street No 11, Nr Panchnath Mandir",BOMBAY STOCK EXCHANGE LIMITED,"Feb 11, 2000 - Perpetual"
SKSE SECURITIES LTD.,compliance@sksesl.com,Compliance,INZ000293432,9102816102000,"Saket Plaza,2nd Floor,Dr.Rajendra Prasad Road,Panchnath Plot, Street No.11,Near Panchnath Mandir,",BOMBAY STOCK EXCHANGE LIMITED,"Feb 17, 2020 - Perpetual"
SKY COMMODITIES INDIA PRIVATE LIMITED,skycommodities@hotmail.com,Skycommodities,INZ000049235,04224358684,"40/41, SHOP NO 4 SNR TOWERS, VYSIAL STREET,",NATIONAL STOCK EXCHANGE OF INDIA LIMITED,"Dec 01, 2015 - Perpetual"
SMART EQUITY BROKERS PRIVATE LIMITED,ashok.sharma@smartequity.in,Ashok.sharma,INZ000177636,01145004411,"FC-02, Fourth Floor, TDI Mall, Vishal Enclave Rajouri Garden",BOMBAY STOCK EXCHANGE LIMITED,"Dec 07, 2006 - Perpetual"
SMC GLOBAL (IFSC) PRIVATE LIMITED,ajay@smcindiaonline.com,Ajay,INZ000097436,01130111000,"Unit No. 222, 2nd Floor, Signature Building, Block 13B, Road 1C, Zone 1, GIFT SEZ, GIFT CITY,",INDIA INTERNATIONAL EXCHANGE (IFSC) LIMITED,"Jan 11, 2017 - Perpetual"
SMC GLOBAL SECURITIES LIMITED,sca@smcebroker.com,Sca,INZ000199438,00119810080226,"11/6B, SHANTI CHAMBERS PUSA ROAD, NEW DELHI",INDIAN CLEARING CORPORATION LIMITED(ICCL),"Aug 30, 1995 - Perpetual"
SMIFS LIMITED,compliance@smifs.com,Compliance,INZ000220635,9103322893401,"VAIBHAV, 5TH FLOOR 4 LEE ROAD",NATIONAL STOCK EXCHANGE OF INDIA LIMITED,"Jan 31, 2019 - Perpetual"
SMK SHARES & STK BROKING P LTD,dsk777@rediffmail.com,Dsk777,INZ000217239,9102222721175,"224,P.J.TOWER DALAL STREET FORT MUMBAI CITY",NATIONAL STOCK EXCHANGE OF INDIA LIMITED,"Jan 07, 1998 - Perpetual"
SMP SECURITIES LIMITED,smpsecurities@yahoo.com,Smpsecurities,INZ000274734,9101127891873,"FLAT NO 33, CSC-9, G BLOCK, DDA MARKET, SEC-15,ROHINI",INDIAN CLEARING CORPORATION LIMITED(ICCL),"May 25, 2011 - Perpetual"
SOCIETE GENERALE SECURITIES INDIA PVT. LTD.,sujit.kadakia@sgcib.com,Sujit.kadakia,INZ000093534,09102266181618,"Peninsula Business Park, Unit 1901, 19th Floor, Tower A, Ganpatrao Kadam Marg, Lower Parel",NATIONAL STOCK EXCHANGE OF INDIA LIMITED,"Oct 14, 2016 - Perpetual"
SODHANI SECURITIES LTD,sodhani@bom2.vsnl.net.in,Sodhani,INZ000242534,910222614399,"K. BUILDING, 3RD FLOOR, WALCHAND HIRACHAND MARG, BALLARD ESTATE,",NSE Clearing Limited,"Mar 31, 1998 - Perpetual"
SOMAYAJULU & CO. LIMITED,mohammedharoon@somayajululimited.com,Mohammedharoon,INZ000273538,9104442658070,"961,SIYAT HOUSE,FIRST FLOOR POONAMALLE HIGH ROAD,KILPAUK",NSE Clearing Limited,"Aug 08, 1994 - Perpetual"
SOMNATH PHULARI BROKERAGE LIMITED,somnathphulari@gmail.com,Somnathphulari,INZ000009118,9102025513778,"2ND FLOOR, SIMA APARTMENT OPP FERGUSSON COLLEGE, F C ROAD",INDIAN CLEARING CORPORATION LIMITED(ICCL),"Sep 08, 2015 - Perpetual"
SOUTH ASIAN STOCKS LTD.,info@sasonline.in,Info,INZ000164738,9101147377200,"PLOT NO.5, 3RD FLOOR, LOCAL SHOPPING COMPLEX,RISHABH VIHAR,",BOMBAY STOCK EXCHANGE LIMITED,"Apr 22, 1996 - Perpetual"
SOUTH GUJARAT SHARES & SHAREBROKERS LIMITED,yacoobali_venture@hotmail.com,Yacoobali_venture,INZ000244231,910222601296,"3RD FLOOR, BELGIUM CHAMBERS, OPP. LINEAR BUS STOP, RING ROAD,",METROPOLITAN STOCK EXCHANGE,"Feb 27, 1996 - Perpetual"
SPAN CAPLEASE PVT. LTD.,kaushal.shah@spancaplease.com,Kaushal.shah,INZ000183933,007948952052,"22, NILKANTH BUNGLOWS, B/H HDFC BANK, PRAHLAD NAGAR ROAD,SATELLITE",NATIONAL STOCK EXCHANGE OF INDIA LIMITED,"Nov 26, 1998 - Perpetual"
SPARK CAPITAL ADVISORS (INDIA) PVT. LTD.,suresh@sparkcapital.in,Suresh,INZ000268933,9104443440000,"REFLECTIONS,NEW NO.2, LEITH CASTLE CENTRE STREET,SANTHOME HIGH ROAD",INDIAN CLEARING CORPORATION LIMITED(ICCL),"Mar 22, 2006 - Perpetual"
SPARK FAMILY OFFICE AND INVESTMENT ADVISORS (INDIA) PRIVATE LIMITED,pwm.broking@sparkcapital.in,Pwm.broking,INZ000285135,9104466603063,"Reflections No 2, Leith Castle Center Street Santhome High Road, Santhome",BOMBAY STOCK EXCHANGE LIMITED,"Sep 30, 2019 - Perpetual"
SPARK INSTITUTIONAL EQUITIES PRIVATE LIMITED,mahesh.a@avendusspark.com,Mahesh.a,INZ000307037,0918080023220,"REFLECTIONS,NEW NO.2,OLD NO.12 LEITH CASTLE CENTRE STREET,SANTHOME HIGH ROAD, SANTHOME",BOMBAY STOCK EXCHANGE LIMITED,"Jul 06, 2023 - Perpetual"
SPARK SECURITIES PVT. LTD.,compliance@sparksecurities.com,Compliance,INZ000219434,9103322908100,10/4B 3RD FLOOR LALA LAJPAT RAI SARANI NEAR FORUM MARKET ELGIN ROAD,NATIONAL STOCK EXCHANGE OF INDIA LIMITED,"Aug 08, 1995 - Perpetual"
SPARKLE SECURITIES SOLUTIONS PRIVATE LIMITED,kunjal.anjaria@sparklesecurities.com,Kunjal.anjaria,INZ000257237,9102267592000,"E-501, REMI BIZ COURT, OFF.VEERA DESAI ROAD, ANDHERI WEST",NATIONAL STOCK EXCHANGE OF INDIA LIMITED,"Jun 20, 2008 - Perpetual"
SPENNY FINTECH PRIVATE LIMITED,rathin@spennyapp.com,Rathin,INZ000304034,9109503369088,"677, 1st Floor, Suite No.239, 27th Main, 13th Cross, Sector 1, HSR Layout,",BOMBAY STOCK EXCHANGE LIMITED,"Feb 03, 2022 - Perpetual"
SPFL SECURITIES LIMITED,info@spfl.co.in,Info,INZ000214237,9105122330984,"A-1662,STREET NO. 15, G.F., GOVIND PURI, KALKA JI,EAST DELHI",NATIONAL STOCK EXCHANGE OF INDIA LIMITED,"Oct 19, 1995 - Perpetual"
SPREAD X SECURITIES PRIVATE LIMITED,info@spreadx.in,Info,INZ000310930,91799227443340,"D-602, TITANIUM SQUARE, NR. B.M.W SHOW ROOM, S.G.HIGHWAY,",BOMBAY STOCK EXCHANGE LIMITED,"Jan 24, 2023 - Perpetual"
SPS SHARE BROKERS PRIVATE LIMITED,spshares@vsnl.com,Spshares,INZ000206136,9102262746274,"121/4, AGRA BUILDING 1ST FLOOR, M G ROAD, FORT",METROPOLITAN STOCK EXCHANGE,"Dec 30, 1997 - Perpetual"
SRI SHIRDI SECURITIES PRIVATE LIMITED,info@srishirdicapital.com,Info,INZ000165032,9108662570164,"27-20-40, 1ST FLOOR MUSEUM ROAD, GOVERNORPET",BOMBAY STOCK EXCHANGE LIMITED,"Jan 03, 2001 - Perpetual"
SS CORPORATE SECURITIES LIMITED,sscorporate@rediffmail.com,Sscorporate,INZ000219533,9101147003600,"308,3RD FLOOR, D - BLOCK,NDM - 2, NETAJI SUBHASH PLACE, PITAMPURA",BOMBAY STOCK EXCHANGE LIMITED,"Jul 26, 1995 - Perpetual"
SSD SECURITIES PRIVATE LIMITED,mailbox@ssdsecurities.in,Mailbox,INZ000200930,9103322902100,"Ideal Plaza, Suite N316, 3rd Floor 11/1 Sarat Bose Road,",NSE Clearing Limited,"Oct 07, 2005 - Perpetual"
SSJ FINANCE AND SECURITIES PRIVATE LIMITED,co@ssjfinance.com,Co,INZ000178436,912223633749,"SURYA MAHAL, 1ST FLOOR 5, BURJORJI BHARUCHA MARG, FORT",NSE Clearing Limited,"Apr 11, 1997 - Perpetual"
SSM SECURITIES PVT. LTD.,ssm_sec@yahoo.co.in,Ssm_sec,INZ000194130,912222838045,"513, RAHEJA CENTRE NARIMAN POINT",NATIONAL STOCK EXCHANGE OF INDIA LIMITED,"Apr 06, 2000 - Perpetual"
SSPL WEALTH PRIVATE LIMITED,anand@asplwealth.com,Anand,INZ000192638,004442169494,"NEW NO.11,OLD NO.5 BISHOP WALLERS AVENUE (WEST)",INDIAN CLEARING CORPORATION LIMITED(ICCL),"Aug 09, 2000 - Perpetual"
STABLE BROKING PRIVATE LIMITED,compliance@stablemoney.in,Compliance,INZ000314637,007715070020,"A103, ALPINE, SALARPURIA GREENAGE,HOSUR ROAD, BOMMANAHALLI,",BOMBAY STOCK EXCHANGE LIMITED,"Sep 05, 2023 - Perpetual"
STANDARD CHARTERED SECURITIES (INDIA) LIMITED,rajesh.tekadiwala@sc.com,Rajesh.tekadiwala,INZ000231932,9102261355900,"2nd Floor, 23-25 M. G. Road, Fort,",NATIONAL STOCK EXCHANGE OF INDIA LIMITED,"Feb 19, 2009 - Perpetual"
STANDARD SECURITIES & INVESTMENT INTERMEDIATES LIMITED,neelamdhingra12@gmail.com,Neelamdhingra12,INZ000224239,9101147295500,"L-79, Top Floor, Lajpat Nagar - 2,",NSE Clearing Limited,"Oct 17, 1995 - Perpetual"
STANDARD STOCK BROKERS LTD.,ssbl_07016@yahoo.com,Ssbl_07016,INZ000255932,9101124604033,"N-13, GROUND FLOOR, SOUTH EXTENSTION PART-1, DELHI",NSE Clearing Limited,"Oct 17, 1995 - Perpetual"
STAR FINVEST PVT.LTD.,skgupta@starfinvest.in,Skgupta,INZ000160735,01143070750,"311, ARUNACHAL BUILDING 19, BARAKHAMBA ROAD, CONNAUGHT PLACE",BOMBAY STOCK EXCHANGE LIMITED,"Sep 17, 1999 - Perpetual"
STEEL CITY SECURITIES LTD.,steelsec@vsnl.com,Steelsec,INZ000223538,910891762585,"49-52-5/4,SHANTHIPURAM",INDIAN CLEARING CORPORATION LIMITED(ICCL),"Oct 17, 1995 - Perpetual"
STELLAR SECURITIES PRIVATE LIMITED,stellarj@rediffmail.com,Stellarj,INZ000254038,9102228651406,"406, Sanjar Enclave, Opp PVR Milap S V Road, Kandivli West.",INDIAN CLEARING CORPORATION LIMITED(ICCL),"Jul 06, 2010 - Perpetual"
