Name,E-mail,Trade Name,Registration No.,Telephone,Address,Exchange Name,Validity
CORUM SECURITIES PRIVATE LIMITED,jiteshgandhi@corumsecurities.com,Jiteshgandhi,INZ000179435,03324548233,"50/6A,HARISH MUKHERJEE ROAD",METROPOLITAN STOCK EXCHANGE,"Jun 07, 2012 - Perpetual"
CREST FINSERV LIMITED,deepa.patil@tpicap.com,Deepa.patil,INZ000160632,910222240512213,"4TH FLOOR, KALPATARU HERITAGE 127, M. G. ROAD, FORT,",INDIAN CLEARING CORPORATION LIMITED(ICCL),"Apr 05, 1999 - Perpetual"
CRIZAC TECHNOLOGIES PRIVATE LIMITED,manish@crizac.com,Manish,INZ000175032,913330083900,Ground floor wing A CONSTANTIA 11 Dr U N BRAMACHARI street,NATIONAL STOCK EXCHANGE OF INDIA LIMITED,"Apr 11, 2018 - Perpetual"
CROSSEAS CAPITAL SERVICES PRIVATE LIMITED,crosseas@cal2.vsnl.net.in,Crosseas,INZ000201133,910332432369,"37,MARTIN BURN BUILDING,5TH FLOOR 1,R.N.MUKHERJEE ROAD",METROPOLITAN STOCK EXCHANGE,"Jul 22, 2005 - Perpetual"
CROWN CONSULTANTS (P) LTD.,compliance@crownsec.com,Compliance,INZ000198434,9102240690701,"G-6/7, AMIT INDUSTRIAL ESTATE, DR. S. S. RAO ROAD,NEARCITI TOWER, PAREL (E)",NATIONAL STOCK EXCHANGE OF INDIA LIMITED,"Oct 17, 1995 - Perpetual"
D. P. VORA SECURITIES PVT. LTD.,dpvspl@gmail.com,Dpvspl,INZ000253531,9102266578630,"21/22B , KHATAU BUILDING, A.D.MODI MARG, FORT, MUMBAI-23",BOMBAY STOCK EXCHANGE LIMITED,"Oct 21, 2005 - Perpetual"
D. R. SHARE & STOCK BROKERS PRIVATE LIMITED,info@drbrokers.in,Info,INZ000216132,9101714006001,"6277, NICHOLSON ROAD FIRST FLOOR, AMBALA CANTT. AMBALA CANTT.",BOMBAY STOCK EXCHANGE LIMITED,"Oct 12, 2006 - Perpetual"
D.H. SECURITIES PVT. LTD.,hsj249@yahoo.com,Hsj249,INZ000245638,910222723439,"PS 6 ROTUNDA,2ND FLOOR, B S MARG,",METROPOLITAN STOCK EXCHANGE,"Sep 14, 2000 - Perpetual"
D.K.MODI SECURITIES PVT.LTD.,dk.modi@yahoo.co.in,Dk.modi,INZ000233437,9102266360995,"515, ROTUNDA BLDG, MUMBAI SAMACHAR MARG, FORT,",BOMBAY STOCK EXCHANGE LIMITED,"Dec 23, 1998 - Perpetual"
D.M.KANTOL SHARE & STOCK BROKERS PVT. LTD.,jdhanwant0146@rediffmail.com,Jdhanwant0146,INZ000227631,9102222670997,"ROOM NO 12,2ND FLOOR,SURYA MAHAL, 5,BURJORJI BHARUCHA MARG,N.M.ROAD,FORT",INDIAN CLEARING CORPORATION LIMITED(ICCL),"Dec 23, 1998 - Perpetual"
DAIWA CAPITAL MARKETS INDIA PRIVATE LIMITED,indiacompliance@in.daiwacm.com,Indiacompliance,INZ000254737,9102266221000,"UNIT NO. 503, 5TH FLOOR, WINDSOR OFF CST ROAD, KALINA, SANTACRUZ (EAST)",BOMBAY STOCK EXCHANGE LIMITED,"Feb 04, 2008 - Perpetual"
DALAL & BROACHA STOCK BROKING PRIVATE LIMITED,neelhariholdingpvt.ltd@gmail.com,Neelhariholdingpvt.ltd,INZ000210337,912222822992,"506, Maker Chambers V, 221, Nariman Point,",INDIAN CLEARING CORPORATION LIMITED(ICCL),"Dec 30, 1997 - Perpetual"
DALMIA SECURITIES PRIVATE LIMITED,secretarial@dalmiasec.com,Secretarial,INZ000181031,913366120500,"Ideal Plaza, Suite S401, 4th Floor, 11/1, Sarat Bose Road,",INDIAN CLEARING CORPORATION LIMITED(ICCL),"Oct 26, 1994 - Perpetual"
DAM CAPITAL ADVISORS LIMITED,nitin.kapadia@idfc.com,Nitin.kapadia,INZ000207137,9102242022620,"ONE BKC, TOWER C, 15TH FLOOR, UNIT NO. 1511, BANDRA KURLA COMPLEX, BANDRA (EAST),",NATIONAL STOCK EXCHANGE OF INDIA LIMITED,"Aug 20, 2020 - Perpetual"
DAMANI FINANCIAL SERVICES PRIVATE LIMITED,damanifinancial@hotmail.com,Damanifinancial,INZ000186736,912222020682,"7TH FLOOR,MOTI MAHAL 195.J.TATA ROAD",INDIAN CLEARING CORPORATION LIMITED(ICCL),"Jun 27, 2011 - Perpetual"
DARASHAW & COMPANY PVT. LTD,dhanraj-kunder@darashaw.com,Dhanraj-kunder,INZ000231438,9102243022130,"1205-06, Regent Chambers, 208, Nariman Point,",INDIAN CLEARING CORPORATION LIMITED(ICCL),"Dec 31, 1997 - Perpetual"
DARTSTOCK BROKING PRIVATE LIMITED,deepak@dartstock.in,Deepak,INZ000299734,02225628500,"505, Nirmal Galaxy Avior, near Deep Mandir, LBS Marg, Mulund west, Mumbai, 400080",NATIONAL STOCK EXCHANGE OF INDIA LIMITED,"Jun 23, 2021 - Perpetual"
DAULAT SECURITIES LIMITED,daulatsec@hotmail.com,Daulatsec,INZ000261035,9103324744158,"3RD FLOOR,RAMPURIA MARKET, 86,CANNING STREET",NATIONAL STOCK EXCHANGE OF INDIA LIMITED,"Oct 26, 1994 - Perpetual"
DAYCO SECURITIES (IFSC) PRIVATE LIMITED,contact@daycoindia.com,Contact,INZ000098038,03340675066,"Unit No. 232, 2nd Floor, Signature Building, Block 13B, Road 1C Zone-1, GIFT SEZ, GIFT CITY",INDIA INTERNATIONAL EXCHANGE (IFSC) LIMITED,"Jan 15, 2017 - Perpetual"
DAYCO SECURITIES PVT LTD,aditi@daycoindia.com,Aditi,INZ000265037,9103340675074,"113,PARK STREET,PODDAR POINT NORTH BLOCK,7TH FLOOR",BOMBAY STOCK EXCHANGE LIMITED,"Dec 22, 1992 - Perpetual"
DB (INTERNATIONAL) STOCK BROKERS LIMITED,compliance@dbonline.in,Compliance,INZ000179035,0919811706634,"Unit No. P05-02A & P05-02B, 5th Floor, Tower A World Trade Center, Block 51, Road 5E, Zone 5, GIFT CITY",INDIAN CLEARING CORPORATION LIMITED(ICCL),"Oct 26, 1994 - Perpetual"
DBFS SECURITIES LIMITED,ho@dbfsindia.com,Ho,INZ000178534,914448597998,"108,R.M.TOWERS, 2ND FLOOR, CHAIMERS ROAD,NANDANAM",METROPOLITAN STOCK EXCHANGE,"Dec 11, 2008 - Perpetual"
DEAL DEPOT BROKERAGE PRIVATE LIMITED,compliance@dealdepot.in,Compliance,INZ000257137,9102230431510,"904, STOCK EXCHANGE TOWER, 9TH FLOOR DALAL STREET, FORTMUMBAI",INDIAN CLEARING CORPORATION LIMITED(ICCL),"Feb 22, 2008 - Perpetual"
DEAL DEPOT EQUITIES,piyush_prp@yahoo.com,Piyush_prp,INZ000272027,910222657316,"1222,P.J.TOWER,12TH FLOOR, DALAL STREET, FORT",NATIONAL STOCK EXCHANGE OF INDIA LIMITED,"Apr 04, 1995 - Perpetual"
DEEP FINANCIAL CONSULTANTS PVT. LTD.,nita_master@hotmail.com,Nita_master,INZ000266039,9102261549000,"47, MASTERS, HATKESH CHS, 7TH N.S.ROAD, JVPD SCHEME,VILE PARLE (WEST)",NATIONAL STOCK EXCHANGE OF INDIA LIMITED,"Sep 27, 2000 - Perpetual"
DEEPAK GUPTA,deepakguptats@gmail.com,Deepakguptats,INZ000297911,01412606032,"9, Shopping Centre Janta Colony",NATIONAL STOCK EXCHANGE OF INDIA LIMITED,"Feb 18, 2021 - Perpetual"
DEFINEDGE SECURITIES BROKING PRIVATE LIMITED,compliance@definedge.com,Compliance,INZ000301132,9102061923200,"2ND FLOOR, Ambashish Lane no. 9, Pakharbag, NDA Pashan Road, BAVDHAN",BOMBAY STOCK EXCHANGE LIMITED,"Aug 13, 2021 - Perpetual"
DELSTOX STOCKS AND SHARES LIMITED,dse_financial@rediffmail.com,Dse_financial,INZ000214431,9101141010941,"3/1, DSE House Asaf Ali Road",BOMBAY STOCK EXCHANGE LIMITED,"Apr 17, 2002 - Perpetual"
DELTA TECHINVEST PRIVATE LIMITED,deltatechinvest@gmail.com,Deltatechinvest,INZ000294735,00000000,House No 1548 sector 18-D,NATIONAL STOCK EXCHANGE OF INDIA LIMITED,"May 26, 2020 - Perpetual"
DELTAMARK PARTNERS LLP,deltamarkpartnersllp@gmail.com,Deltamarkpartnersllp,INZ000310451,02235752177,"102, RONIT ARCADE, S.V.ROAD, JAVERI BAUG, KANDIVALI (W)",BOMBAY STOCK EXCHANGE LIMITED,"Dec 27, 2022 - Perpetual"
DERIVIUM TRADITION SECURITIES (INDIA) PRIVATE LIMITED,judshi@deriviumcap.com,Judshi,INZ000287035,9102266064615,"10th Floor, Eucharistic Congress Building No.III 5th Convent Road, Near Regal Cinema, Colaba",INDIAN CLEARING CORPORATION LIMITED(ICCL),"Jun 20, 2008 - Perpetual"
DEUTSCHE EQUITIES INDIA PRIVATE LIMITED,pratik.gupta@db.com,Pratik.gupta,INZ000252437,9102271804444,"14th Floor, The Capital, C-70, G Block, Bandra Kurla Complex,",INDIAN CLEARING CORPORATION LIMITED(ICCL),"Jul 11, 2003 - Perpetual"
DEVANSHU INFIN PRIVATE LIMITED,devanshu10@rediffmail.com,Devanshu10,INZ000235231,9101123271394,"4596/7, MAHAVIR NIWAS,IIND FLOOR, 11, DARYAGANJ,EAST DELHI",NATIONAL STOCK EXCHANGE OF INDIA LIMITED,"Aug 29, 1996 - Perpetual"
DEZERV INVESTMENTS PRIVATE LIMITED,compliance@dezerv.in,Compliance,INZ000303136,9102235573866,"Office No. 203, 2nd Floor, Bhaveshwar Arcade Annexe, L.B.S Marg, Opposite Shreyas Cinema, Ghatkopar-West,",BOMBAY STOCK EXCHANGE LIMITED,"Dec 24, 2021 - Perpetual"
DG GOENKA EQUITIES PRIVATE LIMITED,kedia777@hotmail.com,Kedia777,INZ000287235,9102230882228,"PLOT NO.88,TEXPORT HOUSE, ROAD NO.15,MIDC, ANDHERI (EAST)",BOMBAY STOCK EXCHANGE LIMITED,"May 31, 2000 - Perpetual"
DHAN STOCK & SHARE BROKERS PRIVATE LIMITED,info@dhanstock.in,Info,INZ000218037,913322251440,"PODDAR COURT BUILDING, 18,RABINDRA SARANI, GATE NO.3, 4TH FLOOR,",INDIAN CLEARING CORPORATION LIMITED(ICCL),"Apr 20, 2005 - Perpetual"
DHANI STOCKS LIMITED,isl_regulatory@indiabulls.com,Isl_regulatory,INZ000036136,01246685959,"1/1E, FIRST FLOOR, EAST PATEL NAGAR,",BOMBAY STOCK EXCHANGE LIMITED,"Dec 22, 2015 - Perpetual"
DHANKI SECURITIES PVT. LTD.,info@dhankisecurities.com,Info,INZ000237338,9102261717585,"302, HUBTOWN SOLARIS, N.S.PHADKE ROAD, NEAR EAST WEST FLYOVER, ANDHERI(EAST),",INDIAN CLEARING CORPORATION LIMITED(ICCL),"Jan 13, 1998 - Perpetual"
DHARAMSHI SECURITIES PRIVATE LIMITED,hinesh@dharamshi.net,Hinesh,INZ000202832,9102224394444,"QUEST 1073,RAJABHAU DESAI MARG BEHIND BEAU MONDE TOWERS,PRABHADEVI",BOMBAY STOCK EXCHANGE LIMITED,"Dec 31, 1997 - Perpetual"
DHILAN D. KOTHARI,dhilankothari@gmail.com,Dhilankothari,INZ000250611,9102222722194,"1118, STOCK EXCHANGE TOWER, DALAL STREET, FORT,",INDIAN CLEARING CORPORATION LIMITED(ICCL),"Mar 29, 2019 - Perpetual"
DHIREN B. SANGHVI,dsanghvi6508@yahoo.com,Dsanghvi6508,INZ000258810,910222670038,"66,HAJI KASAM BUILDING,2ND FLOOR 66,TAMARIND LANE,FORT",NATIONAL STOCK EXCHANGE OF INDIA LIMITED,"Oct 26, 1994 - Perpetual"
DHWAJA SHARES & SECURITIES PRIVATE LIMITED,contact@dhwaja.com,Contact,INZ000219637,9102242552728,"603, SANJAR ENCLAVE, OPP MILAP CINEMA, KANDIVALI WEST, MUMBAI",NATIONAL STOCK EXCHANGE OF INDIA LIMITED,"Mar 26, 2010 - Perpetual"
DHYAN STOCK BROKING PVT. LTD.,shashi1981.dhyan@gmail.com,Shashi1981.dhyan,INZ000285438,9102240060463,"Shop 1307, 13TH FLOOR, KOHINOOR SQUARE PVT IT PARK N.C.KELKAR ROAD, SHIVAJI PARK, Dadar (West)",INDIAN CLEARING CORPORATION LIMITED(ICCL),"Feb 15, 2000 - Perpetual"
DIAMOND HANDS LLP,operations@essentially.ai,Operations,INZ000307157,9102227777770,"2007-2008, CYBER ONE,PLOT NO.4&6 SECTOR 30A,VASHI",NATIONAL STOCK EXCHANGE OF INDIA LIMITED,"May 31, 2022 - Perpetual"
DILIP MANHARLAL PAREKH,btparekh070@gmail.com,Btparekh070,INZ000226320,9102222721022,"708,ROTUNDA BUILDING, BSE LTD., M.S.MARG, FORT,",BOMBAY STOCK EXCHANGE LIMITED,"Dec 22, 1992 - Perpetual"
DIMENSIONAL SECURITIES PRIVATE LIMITED,bkagarwal@dimensional.in,Bkagarwal,INZ000175837,9103340457100,"12,INDIA EXCHANGE PLACE 4TH FLOOR, KOLKATA",NATIONAL STOCK EXCHANGE OF INDIA LIMITED,"May 27, 1994 - Perpetual"
DINDAYAL BIYANI SECURITIES PRIVATE LIMITED,info@dindayal.net,Info,INZ000205734,910222812030,"417, STOCK EXCHANGE TOWER, DALAL STREET, FORT,",BOMBAY STOCK EXCHANGE LIMITED,"Jan 07, 1998 - Perpetual"
DINESH KUMAR RAMANLAL THANVI,rmthanvi@rediffmail.com,Rmthanvi,INZ000273820,910229820302232,"501, Rotunda Building, Bombay Samachar Marg, Fort,",INDIAN CLEARING CORPORATION LIMITED(ICCL),"Dec 22, 1992 - Perpetual"
DIVYA CAPITAL ONE PRIVATE LIMITED,pratik@divyaportfolio.com,Pratik,INZ000183738,9101204229945,"UNIT NO. PO 4-01, (ABC) 4TH FLOOR, TOWER A , WTC , GIFT CITY, BLDG. NO. 51A, BLOCK 51,ROAD 5E, GIFT CITY",INDIAN CLEARING CORPORATION LIMITED(ICCL),"Dec 26, 2005 - Perpetual"
DIVYA PORTFOLIO (IFSC) PRIVATE LIMITED,divyaportfolioifsc@gmail.com,Divyaportfolioifsc,INZ000099333,919818729358,"Premises No.-230, 2nd Floor, Signature Building, Block -13 B,Zone-1, Gift City",INDIA INTERNATIONAL EXCHANGE (IFSC) LIMITED,"Jan 15, 2017 - Perpetual"
DIVYA SECURITIES,securitiesdivya@gmail.com,Securitiesdivya,INZ000167528,03346005401,Siddha Weston 9 Weston Street Foor 2 Suite No 221,NATIONAL STOCK EXCHANGE OF INDIA LIMITED,"Mar 09, 2018 - Perpetual"
DOLAT ALGOTECH LIMITED,pankajshah@dolatcapital.com,Pankajshah,INZ000285038,02226732602,"UNIT NO. PO6-02A, PO6-02D TOWER A, WTC, BLOCK-51, ZONE 5, ROAD 5E, GIFT CITY",NATIONAL STOCK EXCHANGE OF INDIA LIMITED,"Sep 30, 2019 - Perpetual"
DOLAT CAPITAL IFSC PRIVATE LIMITED,rdshah@dolatcapital.com,Rdshah,INZ000163034,9102226732602,"UNIT NO.238, SECOND FLOOR SIGNATURE 13B, ZONE-1, GIFT SEZ,",INDIAN CLEARING CORPORATION LIMITED(ICCL),"Jan 15, 2018 - Perpetual"
DOLAT CAPITAL MARKET PVT. LTD.,pankaj@dolatcapital.com,Pankaj,INZ000274132,9102261154026,"1401-1409, Dalal Street Commercial Co-op Soc Ltd, Block 53 (Bldg No.53E) Zone-5, Road-5E,",INDIAN CLEARING CORPORATION LIMITED(ICCL),"Apr 19, 1995 - Perpetual"
DOOGAR AND ASSOCIATES SECURITIES PRIVATE LTD.,doogar@ndf.vsnl.net.in,Doogar,INZ000251837,910116474366,"13,COMMUNITY CENTRE EAST OF KAILASH",NATIONAL STOCK EXCHANGE OF INDIA LIMITED,"Feb 01, 1996 - Perpetual"
DRISHTI SHARES & INVESTMENTS PRIVATE LIMITED,drishtishares@gmail.com,Drishtishares,INZ000068833,01141000091,,NSE Clearing Limited,"Sep 01, 2016 - Perpetual"
DURGA PRASAD & CO,raykumar@dpsec.com,Raykumar,INZ000167225,04023755073,"307, PANCOM BUSINESS CENTRE, 8-3-945, AMEERPET X ROAD, AMEERPET",NATIONAL STOCK EXCHANGE OF INDIA LIMITED,"Nov 22, 1995 - Perpetual"
DYNA WEGMANS SECURITIES LIMITED,mail@dynasecurities.in,Mail,INZ000258234,9101126418686,"E-73/74, AMAR COLONY,2ND FLOOR LAJPAT NAGAR IV",NATIONAL STOCK EXCHANGE OF INDIA LIMITED,"Oct 19, 1995 - Perpetual"
DYNAMIC EQUITIES (IFSC) PRIVATE LIMITED,shridhar@dynamiclevels.com,Shridhar,INZ000098731,919831191491,"Unit No. 218, Second Floor , Block 13B Zone 1 Signature Building, GIFT City IFSC",INDIA INTERNATIONAL EXCHANGE (IFSC) LIMITED,"Jan 15, 2017 - Perpetual"
DYNAMIC EQUITIES PRIVATE LIMITED,csb@dynamiccares.com,Csb,INZ000193533,00334009940,"TECHNOPOLIS, 14TH FLOOR PLOT BP-4, SECTOR - V, SALT LAKE",INDIAN CLEARING CORPORATION LIMITED(ICCL),"Dec 09, 1999 - Perpetual"
EAST INDIA SECURITIES LTD.,accounts@eisec.com,Accounts,INZ000190836,913340205915,DA 14 SALT LAKE CITY SECTOR I,METROPOLITAN STOCK EXCHANGE,"Oct 19, 1995 - Perpetual"
EASTERN FINANCIERS LTD.,ambrish@easternfin.com,Ambrish,INZ000193733,913322205886,"14,INDIA EXCHANGE PLACE ALLAHABAD BUILDING,2ND FLOOR",INDIAN CLEARING CORPORATION LIMITED(ICCL),"Oct 09, 2003 - Perpetual"
ECONO BROKING PRIVATE LIMITED,bansalgroup2002@yahoo.com,Bansalgroup2002,INZ000301331,91027821413100,"PLOT NO 2137 A, NEAR GOLDEN ARC COMPLEX, ATABHAI CHOWK BHAVNAGAR",BOMBAY STOCK EXCHANGE LIMITED,"Aug 23, 2021 - Perpetual"
EDEL INVESTMENTS LIMITED,complianceofficer.eil@edelweissfin.com,Complianceofficer.eil,INZ000173431,09140885679,"2nd Floor, MB Towers Plot No. 5, Road No. 2",BOMBAY STOCK EXCHANGE LIMITED,"Aug 11, 2014 - Perpetual"
EDELWEISS SECURITIES (IFSC) LIMITED,cs@edelweissfin.com,Cs,INZ000097238,9102240886188,"UNIT NO.907, 9TH FLOOR, SIGNATURE TOWER, BLOCK 13-B, ZONE-1, GIFT SEZ, GIFT CITY,",INDIA INTERNATIONAL EXCHANGE (IFSC) LIMITED,"Jan 11, 2017 - Perpetual"
EDGE SECURITIES PRIVATE LIMITED,info@edgeonline.in,Info,INZ000244338,9102266597500,"717, DALAMAL TOWER, FREE PRESS JOURNAL MARG 211, NARIMAN POINT,",INDIAN CLEARING CORPORATION LIMITED(ICCL),"Sep 20, 2010 - Perpetual"
ELARA SECURITIES (INDIA) PRIVATE LIMITED,anand.rao@elaracapital.com,Anand.rao,INZ000238236,912261648509,"One International Center, Tower 3, 21st Floor, Senapati Bapat Marg, Elphinstone Road West,",BOMBAY STOCK EXCHANGE LIMITED,"Dec 18, 2007 - Perpetual"
ELBEE SECURITIES PVT. LTD.,elbeesec@cal.vsnl.net.in,Elbeesec,INZ000199535,910332435519,"EASTERN BUILDING,2ND FLOOR 19,R.N.MUKHERJEE ROAD",BOMBAY STOCK EXCHANGE LIMITED,"Jul 03, 2000 - Perpetual"
ELIOS FINANCIAL SERVICES PRIVATE LIMITED,secretarial@eliosfin.com,Secretarial,INZ000306737,02235742152,"410, B-WING, KNOX PLAZA,CHINCHOLI BUNDER ROAD, MALAD WEST,",BOMBAY STOCK EXCHANGE LIMITED,"May 17, 2022 - Perpetual"
EMKAY GLOBAL FINANCIAL SERVICES LIMITED,compliance@emkayglobal.com,Compliance,INZ000203933,9102266121212,"The Ruby, 7th Floor, Senapati Bapat Marg, Dadar (West)",METROPOLITAN STOCK EXCHANGE,"Mar 13, 1996 - Perpetual"
ENAM HOLDINGS PRIVATE LIMITED,enamholdclaw@yahoo.in,Enamholdclaw,INZ000292836,09102249490790,"EXPRESS TOWERS, 11TH FLOOR, NARIMAN POINT",METROPOLITAN STOCK EXCHANGE,"Feb 12, 2020 - Perpetual"
ENAM INVESTMENT & SERVICES PRIVATE LIMITED,eispl.office@gmail.com,Eispl.office,INZ000312132,9102266376491,"128-129, Mittal Chamber, Nariman Point,",BOMBAY STOCK EXCHANGE LIMITED,"Jan 13, 1998 - Perpetual"
ENRICH FINANCIAL MARKET PRIVATE LIMITED,ponmudi_fm@yahoo.com,Ponmudi_fm,INZ000078632,1140057000,"New No. 241, Old No. 85-86, 3rd Floor, Rangarajapuram Main Road, Kodambakkam,",BOMBAY STOCK EXCHANGE LIMITED,"Dec 07, 2015 - Perpetual"
ENRICH FINANCIAL SERVICES,ponmudi@enrichbroking.com,Ponmudi,INZ000203821,04430035035,"NEW NO. 241, OLD NO. 85-86 RANGARAJAPURAM MAIN ROAD",NSE Clearing Limited,"Sep 28, 2018 - Perpetual"
EPP SECURITIES PRIVATE LIMITED,rajshah@epp.co.in,Rajshah,INZ000301733,0281123456789,"1202-1203 12th Floor R K Prime, Besides Silver Heights, Nana Mava circle, 150ft Ring road",NATIONAL STOCK EXCHANGE OF INDIA LIMITED,"Sep 16, 2021 - Perpetual"
EQUIRUS SECURITIES PRIVATE LIMITED,vishad.turakhia@equirus.com,Vishad.turakhia,INZ000251536,9102243320633,"A-2102 B, A WING, 21ST FLOOR, MARATHON FUTUREX, N. M. JOSHI MARG, LOWER PAREL",BOMBAY STOCK EXCHANGE LIMITED,"Jul 04, 2008 - Perpetual"
EQUIRUS WEALTH PRIVATE LIMITED,compliance@equiruswealth.com,Compliance,INZ000309137,02243320600,"21ST FLOOR, A WING, OFFICE NO. A-2102 B, MARATHON FUTUREX, N. M. JOSHI MARG, LOWER PAREL,",BOMBAY STOCK EXCHANGE LIMITED,"Oct 20, 2022 - Perpetual"
ESPRESSO FINANCIAL SERVICES PRIVATE LIMITED,compliance@myespresso.com,Compliance,INZ000041331,9102261150000,"The Ruby ,18th Floor 29 Senapati Bapat Marg Dadar West",INDIAN CLEARING CORPORATION LIMITED(ICCL),"Feb 18, 2021 - Perpetual"
ESTEE ADVISORS PRIVATE LIMITED,sanjeev.kumar@esteeadvisors.com,Sanjeev.kumar,INZ000300737,9101244896769,"PO5-01A, PO5-01B, PO5-01C 5TH FLOOR, TOWER A, WTC GIFT CITY BLOCK-51, ROAD 5E, ZONE 5, GANDHINAGAR",BOMBAY STOCK EXCHANGE LIMITED,"Aug 03, 2021 - Perpetual"
ESTEE IFSC PVT LTD,ebo@esteeadvisors.com,Ebo,INZ000099036,918000737308,"Unit No 327,Singnature Building, Third Floor , Block 13B , Zone 1 , Gift SEZ",INDIA INTERNATIONAL EXCHANGE (IFSC) LIMITED,"Jan 15, 2017 - Perpetual"
ESTELLE SECURITIES PRIVATE LIMITED,estellegroup@hotmail.com,Estellegroup,INZ000297338,9103322367932,"59, Bentinck Street, 1st Floor,",BOMBAY STOCK EXCHANGE LIMITED,"Dec 23, 2020 - Perpetual"
EUREKA STOCK & SHARE BROKING SERVICES LTD.,rakesh@eurekasecurities.com,Rakesh,INZ000169839,03340511500,"MERLIN INFINITE,DN - 51, 1101, 11TH FLOOR",BOMBAY STOCK EXCHANGE LIMITED,"Dec 18, 2003 - Perpetual"
EVAREAP SECURITIES PRIVATE LIMITED,sharathchandran.3@gmail.com,Sharathchandran.3,INZ000299437,9104442072403,"No.1, FOURTH STREET GOPALAPURAM,",BOMBAY STOCK EXCHANGE LIMITED,"Jun 03, 2021 - Perpetual"
EVEREST CREATORS PRIVATE LIMITED,accounts@anmolmedicare.com,Accounts,INZ000203235,9107961609999,"2nd Floor, NBCC House, Opp. Ahmedabad Stock Exchange, Ambawadi,",BOMBAY STOCK EXCHANGE LIMITED,"Sep 26, 2018 - Perpetual"
EVERMORE SHARE BROKING PRIVATE LIMITED,backoffice@evermore.in,Backoffice,INZ000022431,9107940051348,"Unit-1-A, 15th Floor Tower-1, Gift City",NATIONAL STOCK EXCHANGE OF INDIA LIMITED,"Dec 25, 2015 - Perpetual"
EVERMORE STOCK BROKERS PRIVATE LIMITED,yp@evermore.in,Yp,INZ000217838,912242229945,"Unit-1-A, 15th Floor GIFT City",BOMBAY STOCK EXCHANGE LIMITED,"Oct 06, 1995 - Perpetual"
EXCEL BROKING (IFSC) PVT.LTD,anilkedia@excelstockbroking.com,Anilkedia,INZ000098830,0913366132706,"Unit No. 239, Signature Building, second floor, Block 13B, Zone 1, Gift SEZ,",INDIA INTERNATIONAL EXCHANGE (IFSC) LIMITED,"Jan 15, 2017 - Perpetual"
EXCEL DEBT BROKING PRIVATE LIMITED,excelbroking@gmail.com,Excelbroking,INZ000162538,9102242977600,"73/C, 7TH FLOOR, MITTAL COURT, NARIMAN POINT,",BOMBAY STOCK EXCHANGE LIMITED,"Jan 03, 2018 - Perpetual"
EXCEL FINCAP LTD.,xlfield@rediffmail.com,Xlfield,INZ000272237,9104023545916,"3, SAGAR SOCIETY RD NO 2, BANJARA HILLS",NATIONAL STOCK EXCHANGE OF INDIA LIMITED,"Oct 17, 1995 - Perpetual"
EXCEL STOCK BROKING PRIVATE LIMITED,ravisharma@excelstockbroking.com,Ravisharma,INZ000196232,9103366132737,"CENTRE POINT, 3RD FLOOR, ROOM NO. 309 21, HEMANT BASU SARANI",NSE Clearing Limited,"Aug 04, 2008 - Perpetual"
EXCLUSIVE SECURITIES LIMITED,esl@exclusivegroup.co.in,Esl,INZ000177234,9107312528084,"113, B-BLOCK, SILVERMAL 8-A, RNT MARG",NSE Clearing Limited,"Sep 14, 1995 - Perpetual"
EXPRESS SECURITIES PVT.LTD.,esplshare@gmail.com,Esplshare,INZ000251034,9101142355271,"10-A, SCINDIA HOUSE, CONNAUGHT CIRCUS",INDIAN CLEARING CORPORATION LIMITED(ICCL),"Sep 02, 1999 - Perpetual"
FAIR INTERMEDIATE INVESTMENT (P) LTD.,support@fairinvest.co.in,Support,INZ000185032,005224040511,"SHUKLA PALACE,2ND FLOOR SAPRU MARG",METROPOLITAN STOCK EXCHANGE,"Aug 13, 2004 - Perpetual"
FARSIGHT SECURITIES LTD.,compliance@farsightshares.com,Compliance,INZ000169935,01145044444,17A 55 Floor No 2 Farsight Triveni Plaza Gurudwara Road Karol Bagh New Delhi,NATIONAL STOCK EXCHANGE OF INDIA LIMITED,"Jan 12, 1996 - Perpetual"
FAST CAPITAL MARKETS LIMITED,fastcapital5@hotmail.com,Fastcapital5,INZ000212231,9103340564545,"CALCUTTA MANSION, SUITE No. 10, 4TH FLOOR 4, BISHOP LEFROY ROAD",NATIONAL STOCK EXCHANGE OF INDIA LIMITED,"Mar 13, 2008 - Perpetual"
FE SECURITIES PVT. LTD.,fes@fesecurities.in,Fes,INZ000240438,9101123317382,"814, Arunachal Building, 19, Barakhamba Road,",INDIAN CLEARING CORPORATION LIMITED(ICCL),"Aug 08, 1995 - Perpetual"
FEDERAL CAPITAL MARKETS LIMITED,federalcapitalmarkets@gmail.com,Federalcapitalmarkets,INZ000210834,9108043005880,"NO.583, FEDERAL HOUSE, SIDDAPURA, WHITEFIELD-VARTHUR ROAD",BOMBAY STOCK EXCHANGE LIMITED,"Jan 10, 2012 - Perpetual"
FINANCE MONITOR (I) PVT. LTD.,fmipl@rediffmail.com,Fmipl,INZ000250337,910224076200,"E MANGALAM,GROUND FLOOR, 155, JAIN SOCIETY, SION W",BOMBAY STOCK EXCHANGE LIMITED,"Aug 30, 1995 - Perpetual"
FINCAP PORTFOLIO LIMITED,vishal.suneja@fincaporg.com,Vishal.suneja,INZ000289238,910116568270,"222-223,AASHIRWAD ,D-1,GREEN PARK",NATIONAL STOCK EXCHANGE OF INDIA LIMITED,"Feb 01, 1996 - Perpetual"
FINDOC INVESTMART PRIVATE LIMITED,ravinder.singla@myfindoc.com,Ravinder.singla,INZ000164436,9101725211522,"SCO-210-211, SECTOR 34-A",BOMBAY STOCK EXCHANGE LIMITED,"Dec 07, 2012 - Perpetual"
FINOPIA FINTECH PRIVATE LIMITED,info@finopiafintech.com,Info,INZ000304635,9107842464770,"H. No. 6-5-39/1 (Old No. 5-40), Balangar Old Village, Besides Hanuman Temple,",BOMBAY STOCK EXCHANGE LIMITED,"Mar 02, 2022 - Perpetual"
FINQUEST SECURITIES PRIVATE LIMITED,dchavda@finquestonline.com,Dchavda,INZ000268435,9102240002600,"602, Boston House, 6th Floor, Suren Road, Near WEH Metro Station, Andheri (East),",INDIAN CLEARING CORPORATION LIMITED(ICCL),"Sep 22, 2005 - Perpetual"
FINVASIA SECURITIES PRIVATE LIMITED,ccofspl@finvasia.com,Ccofspl,INZ000176037,9101724003400,1108 SECTOR 21-B,NSE Clearing Limited,"Apr 17, 2013 - Perpetual"
FINWIZARD TECHONOLOGY PRIVATE LIMITED,subu@fisdome.com,Subu,INZ000209036,9108030408363,"Queens Paradise, 1st floor, Curve Road, Shivajinagar,",BOMBAY STOCK EXCHANGE LIMITED,"Nov 14, 2018 - Perpetual"
FIRST GLOBAL STOCKBROKING PRIVATE LIMITED,info@firstglobal.in,Info,INZ000210739,9101161304122,"15/38, G/F GEETA COLONY, BACK PORTION MOTHER DAIRY, KRISHNA NAGAR",INDIAN CLEARING CORPORATION LIMITED(ICCL),"May 29, 1995 - Perpetual"
FIRST INDIA SECURITIES PVT. LTD.,first.india.sec@gmail.com,First.india.sec,INZ000224338,9102222040721,"25, MAKER CHAMBERS VI, 220, NARIMAN POINT",BOMBAY STOCK EXCHANGE LIMITED,"Oct 07, 2005 - Perpetual"
FLORA SECURITIES,dinesh@florasecurities.com,Dinesh,INZ000288526,9102226556124,"1 FLOOR,A/4,GURUNANK ROAD NOOTAN NAGAR, BANDRA (W)",NATIONAL STOCK EXCHANGE OF INDIA LIMITED,"Dec 16, 1994 - Perpetual"
FLOURISH FINCAP PRIVATE LIMITED,flourishfincap@yahoo.com,Flourishfincap,INZ000191536,001123238344,"409 & 416,ESSEL HOUSE 10, ASAF ALI ROAD,EAST DELHI",INDIAN CLEARING CORPORATION LIMITED(ICCL),"Jul 31, 2008 - Perpetual"
FLUX CAPITAL PRIVATE LIMITED,fluxcapital.pvt@gmail.com,Fluxcapital.pvt,INZ000297535,01204150184,"FLAT NO. 712, IMPERIAL BLOCK SECTOR-9, SUPERTECH ESTATE, VAISHALI",NATIONAL STOCK EXCHANGE OF INDIA LIMITED,"Dec 23, 2020 - Perpetual"
FOCUS STOCK BROKERS LTD,focusstock@yahoo.com,Focusstock,INZ000288836,9101128714145,"1C/13, NEW ROHTAK ROAD",BOMBAY STOCK EXCHANGE LIMITED,"Jun 12, 1996 - Perpetual"
FOCUS SHARES & SECURITIES PRIVATE LIMITED,bhawani@focuscomtrade.com,Bhawani,INZ000185331,02267473709,"405, 4TH FLOOR, PLOT -206, DALAMAL HOUSE JAMNALAL BAJAJ MARG, NARIMAN POINT",METROPOLITAN STOCK EXCHANGE,"Apr 23, 2008 - Perpetual"
FORT SHARE BROKING PRIVATE LIMITED,fort_sh@yahoo.co.in,Fort_sh,INZ000236431,9103322894497,"9, Rawdon Street 2nd Floor, Room No.7",BOMBAY STOCK EXCHANGE LIMITED,"Jul 28, 2006 - Perpetual"
FORTUNE CAPITAL SERVICES,klg@fortunecapitalservices.com,Klg,INZ000278225,9101123713874,"812,ARUNACHAL 19,BARAKHAMBA ROAD",NATIONAL STOCK EXCHANGE OF INDIA LIMITED,"Jun 12, 2008 - Perpetual"
FORTUNE CAPITAL SERVICES PRIVATE LIMITED,knarayanamoorthy@ftconline.in,Knarayanamoorthy,INZ000201438,9104445609677,"Kochar Technology Park, 6th Floor, SP 31-A,1st Cross Road, Ambattur Industrial Estate,Ambattur Chennai",BOMBAY STOCK EXCHANGE LIMITED,"May 21, 2012 - Perpetual"
FORTUNE FISCAL LTD,ffl@ad1.vsnl.net.in,Ffl,INZ000247236,910265363174,"208,BLUE CHIP,DALAL STREET SAYAJIGANJ",BOMBAY STOCK EXCHANGE LIMITED,"Nov 22, 1995 - Perpetual"
FORTUNE INTERFINANCE LTD.,info@fifi.co.in,Info,INZ000178035,003322101153,"FLAT NO.2 & 3,GROUND FLOOR,19,BRITISH INDIA STREET KOLKATA",BOMBAY STOCK EXCHANGE LIMITED,"Oct 26, 2005 - Perpetual"
FORTUNE WEALTH MANAGEMENT CO. INDIA (P) LTD.,ceo-fortunewmc@yahoo.co.in,Ceo-fortunewmc,INZ000190535,04222217381,"1056, AVINASHI ROAD, OPP THE NILGIRIS",BOMBAY STOCK EXCHANGE LIMITED,"Apr 16, 2004 - Perpetual"
FOURDEGREEWATER SERVICES PRIVATE LIMITED,anshg64@gmail.com,Anshg64,INZ000313632,919840075987,"86/1, Yellappa Reddy Layout Bannerghatta Road, Arakere",NATIONAL STOCK EXCHANGE OF INDIA LIMITED,"Jul 13, 2023 - Perpetual"
FRONTLINE CAPITAL SERVICES PRIVATE LIMITED,fcsl@fcslindia.com,Fcsl,INZ000179633,01202532832,B-22 SECTOR-4 NOIDA,BOMBAY STOCK EXCHANGE LIMITED,"Oct 06, 1995 - Perpetual"
